{
  "schemaVersion": 1,
  "protocolVersion": 1,
  "contractFingerprint": "8afa0e494df95a135967ee3bc50bb006ad9233580f89837936b57be1ef4e7317",
  "input": {
    "taskId": "TASK-008",
    "project": "forgeshop"
  },
  "primary": "implementation",
  "guides": [
    "typescript",
    "test"
  ],
  "reasons": {
    "implementation": [
      "Revised scope needs a fresh route and plan"
    ]
  },
  "excluded": {}
}
